{
  "$schema": "https://json-schema.org/draft/2020-12/schema",
  "$id": "https://raw.githubusercontent.com/hummbl-dev/security-as-code/main/schemas/security-as-code-v0.1.json",
  "title": "Security-as-Code v0.1 Packet",
  "type": "object",
  "required": [
    "schemaVersion",
    "packetStatus",
    "securityManifest",
    "authority",
    "checks",
    "receiptRequirements"
  ],
  "properties": {
    "schemaVersion": {
      "type": "string",
      "const": "v0.1"
    },
    "packetStatus": {
      "type": "string",
      "enum": ["seed", "v0.1-draft", "validated-example", "v0.1-packet"]
    },
    "securityManifest": {
      "type": "object",
      "required": ["id", "title", "version", "scope"],
      "properties": {
        "id": {
          "type": "string",
          "pattern": "^[a-z0-9][a-z0-9\\-]*/[a-z0-9][a-z0-9\\-]*$"
        },
        "title": {
          "type": "string"
        },
        "version": {
          "type": "integer",
          "minimum": 1
        },
        "scope": {
          "type": "string"
        },
        "description": {
          "type": "string"
        }
      },
      "additionalProperties": false
    },
    "authority": {
      "type": "object",
      "required": ["owner", "canActOnBehalfOf"],
      "properties": {
        "owner": {
          "type": "string"
        },
        "canActOnBehalfOf": {
          "type": "array",
          "minItems": 1,
          "items": {
            "type": "string"
          }
        }
      },
      "additionalProperties": false
    },
    "checks": {
      "type": "array",
      "minItems": 1,
      "items": {
        "type": "object",
        "required": ["id", "name", "type", "severity", "status"],
        "properties": {
          "id": {
            "type": "string",
            "pattern": "^[a-z0-9\\-]+$"
          },
          "name": {
            "type": "string"
          },
          "type": {
            "type": "string",
            "enum": ["threat", "permission", "secret", "dependency", "runtime"]
          },
          "severity": {
            "type": "string",
            "enum": ["low", "medium", "high", "critical"]
          },
          "status": {
            "type": "string",
            "enum": ["pass", "warn", "fail", "manual-review"]
          },
          "outcome": {
            "type": "string"
          },
          "evidence": {
            "type": "array",
            "items": {
              "type": "string"
            }
          }
        },
        "additionalProperties": false
      }
    },
    "exceptionPolicy": {
      "type": "object",
      "required": ["enabled", "requiresSecurityReview", "requiresExceptionReceipt"],
      "properties": {
        "enabled": {
          "type": "boolean"
        },
        "requiresSecurityReview": {
          "type": "boolean"
        },
        "requiresExceptionReceipt": {
          "type": "boolean"
        },
        "approverRole": {
          "type": "string",
          "minLength": 1
        }
      },
      "additionalProperties": false
    },
    "receiptRequirements": {
      "type": "object",
      "required": ["threat", "permission", "secretBoundary", "dependency", "review", "exception", "release"],
      "properties": {
        "threat": {
          "type": "string",
          "minLength": 1
        },
        "permission": {
          "type": "string",
          "minLength": 1
        },
        "secretBoundary": {
          "type": "string",
          "minLength": 1
        },
        "dependency": {
          "type": "string",
          "minLength": 1
        },
        "review": {
          "type": "string",
          "minLength": 1
        },
        "exception": {
          "type": "string",
          "minLength": 1
        },
        "release": {
          "type": "string",
          "minLength": 1
        }
      },
      "additionalProperties": false
    },
    "adjacentRepos": {
      "type": "array",
      "items": {
        "type": "string"
      }
    }
  },
  "additionalProperties": false
}
